{
  "eventId": "0190a2a4-f7a1-77ef-9021-d52eac3c7452",
  "ownerId": "uid_test_user_123",
  "eventType": "audit_log",
  "participants": [
    { "role": "object", "ref": { "entityType": "object", "id": "0190a2a4-f7a1-77ef-9021-d52eac3c7457" } }
  ],
  "participantKeys": ["object:0190a2a4-f7a1-77ef-9021-d52eac3c7457"],
  "objectIds": ["0190a2a4-f7a1-77ef-9021-d52eac3c7457"],
  "markerKeys": [],
  "placeIds": [],
  "readerIds": [],
  "deviceIds": [],
  "userIds": [],
  "time": {
    "occurredAt": "2026-07-11T18:00:00Z"
  },
  "provenance": {
    "source": "user_confirmed",
    "confidence": "high"
  },
  "_meta": {
    "recordCreatedAt": "2026-07-11T18:00:00Z",
    "recordUpdatedAt": "2026-07-11T18:00:00Z",
    "recordCreatedBy": "system_bot",
    "recordUpdatedBy": "system_bot",
    "schemaVersion": 1
  }
}
